,review_comments,star_rating
148,"Very very very bad controls. Controlling cannon is impossible. Also game has a lot of glitches. Sometimes I am able to pass block which I didn't destroy. Sometimes I destroy block and continue further but there are no blocks. Only black background and endless darkness.  "")",2
162,"Didnt even get started.  Options not working. Cant turn off sound, i dont want special effects noises when im trying to listen to music when playing. Oh yes why does everytime it appears on Free Solitaire it cuts my Spotify off. I have to go out off the soltaire app, go to Spotify and start it again. I realise if something is free there has to be ads, but why make it so annoying, most of them dont do that.  ')",1
163,"The game is very addictive and fun to play. Some of the people playing the game are wonderful and fun to game with. Graphics are very good for a on line game played on phone, tablet or computer. The quests are challenging at best. BUT!!! BE WARNED... This game is not for young children as there is explicit language and cut throat people playing the game. After all it is a war game and nothing more. Now down to the nitty-gritty of the game. Yes it's free, but that only get you so far before you will need to buy packs in the game to advance and unlock the two new characters. The game quests are designed for people to spend if you want to get ahead fast. Large amounts of  $$$$$$ Cash are needed to play this game. $$$$$$ Personal note, I know people who have spent thousands on this game. Over all the game is great for young adults on up. PG-15  "")",3
164,"It's okay, but not all the roller coaster work! I can only use 2 :( beside that the game is okay.  "")",3
168,"Honestly I love Marvel but this game is awful, don't get me wrong it's very fun at first but once you get to a certain level it becomes pay-to-win. It's impossible to progress without paying and that destroys the game for me. If you're cool with throwing your paycheck at a game then this is the game for you. Atleast Marvel Future Fight let's you choose a Max character off the bat, and progression can be made without emptying your pockets.  "")",1
170,"The game itself is enjoyable and the controls are quite simple. Very intuitive. But Jesus Christ on a frosty log, the ads are way to much. After every round, ad, want your prize? Ad. Wanna do anything in the game? Enjoy the ad. Jesus guys, I don't mind ads and I understand that's how you make money, but you shouldn't have to watch an ad to get your prize for winning... Come on.  "")",3
176,"Don't waste your time, game is glitchy and people are getting random charges when they never purchased anything and customer support is completely horrendous they won't even acknowledge when there's a problem with purchases u never bought or when u have a problem in game if you even get a reply it's a rude and sny one saying it your fault! Keep your money safe and don't play this glitchy game!  "")",1
177,"Well I tried but I'm deleting it now. I've been screwed too many times. Listen developers, if someone makes perfect shots and plays right down the fairways, tries to allow for wind they shouldn't be beat every time by people playing out of the rough. I developed my clubs but that makes no difference. I'm done, back to clash of clans and puzzle quest where when you build a character they get better and can't be beat by a beginner playing out of sand traps. Better luck next timr  "")",3
180,"I love the game but there is a issue, in some of the games the app kicks me out of that certain game ,like Bikini Bottom Betta, I play 5 min then it kicks me out. I have no proplem wifi connections and also. The customize your characte,you must buy thing with real money. No man! I have to spwnd money just to enjoy a game. Plz fix this or I unstall this game!ÙüèÏå_  ')",3
181,"I used to play this game lots, but got annoyed and stopped playing, after my tablet needed a factory reset and everything I'd collected over nearly 2 years had gone.  Also everything I purchased had also vanished.  I'm going to check my emails, because I should have receipts for everything, including the option to remove adverts, which I'm already tired of after only 1 day.  I had 1,000's of keys, purchased characters, boards and other things.  I would like them back or refunding my money.  I paid money on both my Hudl2 android tablet & my Windows 8.1 & Windows 10 phones.  Now I have a Galaxy S8 and feel what I paid for, should be automatically added to my game.  I play DoubleU Casino and I can play on my Hudl2, Kindle Fire 8 HD and through Facebook on my laptop and each device has everything I've earned & purchased.  I feel ripped off.  "")",3
182,"The game is very addicting and a great way to pass time. The only fault is once your wallet becomes full of coins they force you to buy a piggy bank for $2.99 or you can no longer collect coins. This happened to me around level 100/901. There is nothing in game you can use the coins for!! You can only hoard them. Don't fall victim to the piggy bank scam. Great game though.  "")",3
186,Can you add a feature to turn off the blasted hints? I loved this game for a long time until the hints became so that I barely have my move finished before the next one is being flashed in front of me. It takes away the fun of the game and the problem solving skills I like to use. If changed my rating will be as-well.  '),2
187,"This game is actually A LOT of fun and a pretty good time killer. I don't mind the ads so much but It did get kind of annoying. My only real complaint is that there is NO SOUND.   And for a game like this it needs music and explosions to make it a great game.  "")",3
195,"Upset. Really liked the game and didnt mind the ads (as I don't want to pay for ad free) however inappropriate ads for half dressed women for a Latino dating app I don't agree with. My daughter likes this game and that's not something I want her viewing at her age. I completely understand showing ads to support the app financially but all ads should be all age appropriate. Uninstalling.  "")",1
197,"I like this daft little game for my little boy who is 4, but I also enjoy secretly playing it myself to pass time. I like the whimsical, cutesyness of it and he is a kid who is obsessed with what he can find on mummy's phone... What's not to enjoy? Of course there are ads, you pay cac all for the game so just enjoy it don't whine! :-)  "")",3
199,"It's okay but I hit level 27 and I can't kill anyone everyone is 10 LEVELS HIGHER THAN Me you need to fix the matchmaking it is unplayable unless you pay a ton. You should make it so you can only be matched with people your level or maybe the one above  "")",3
201,"Game was excellent till a recent update made it annoying. Crossed many levels in the world tournaments but I didn't get my rewards or diamonds. Please remove these irritating bugs. It is going to spoil this great game and you'll start losing members  "")",1
204,"The thing is that I didn't even got the chance to play it. Just wasted my mb to download this game. Anytime I want to play it,it won't just load and I'm sick and tired of trying. I downloaded it because I saw the graphics and they were so good,nice and easy to fall in love with.      NOT YOUR BEST!ÙüÛ÷À_ÙüÛ÷À_  "")",2
205,"Don't get this app. It is so laggy it is barely playable. Instead of there being a part 70 to 100% chance of getting a new prize, with the new update it became 15% to 30% for a new one. Change the prize chances, and improve lag or I will uninstall and you will stop getting ad revenue from me because of all the ads this game made me watch.  "")",1
206,"New update has a bad lag in it. Can you fix this please? Has a delay in slicing fruit and my ""swipe"" lingers on screen and makes bombs explode. Please fix, will change to 5 stars when done. Thanks!  ')",2
207,"I spend too much time holding the buttons. I can't just tap the screen, I have to tap and hold them release. This causes me to move slower than usual. Cooking Dash is way more easier to use. Play Cooking Fever and then play Cooking Dash, I believe you'll find Cooking Dash a lot easier to navigate. I'm keep this for at least another week if no improvement then I will delete this app.  "")",2
208,"This game sucks! Cotrols are to fast, you can't aim in one block in a hurry. Block have to many hp, you can't destroy them beacuse your damge per ball is to low and to expencive to upgrage. Hate it!!  "")",1
210,"Game's amazing and fun,  I can't run it with a smooth fps on my J7 sadly. I might buy J7 Perx just to be able to play this. If anyone knows if this game can be run on a smooth fps on the J7 Perx, please tell me on my kik (_dont_add_me_) or my instagram(erictt.yg) so I don't buy this phone for nothing. Thank you in advance. Edit: latest update made a major improvement in FPS, but still not playable. When it becomes playable for me, I'll re edit this. Almost there though, just a little more hard work and it'll be amazing, thanks.  "")",3
217,"Would be 5 stars if you could have a paid version without ads. They really detract from the whole experience.  On my Samsung Chromebook, the game can only be rotated for tablet mode in the direction that makes the on/off and volume button on the bottom. so, I can't rest it on a stand with a lip and they get bumped accidentally when being held. Would be great if it rotated the other way.  "")",3
218,"No ads at first, asks you to rate it, then after rating it's starts delivering tons of ads. Obvious trick is obvious.  "")",2
223,"If you like going nowhere very slow this is the game for you. After purchasing two bundles one of which doubles your resource capacity, upgrading all of the resource, you have to spend weeks farming tiles in order to upgrade your castle or do any research. If you're RICH AF you might enjoy this. But each bundle you get just increases the cost from $5 to $20 to $100. I don't have $100 to spend on a phone game so can't tell you if it goes up again  "")",1
224,"Terrible! Don't waste your time  "")",1
228,"Always been a buggy and lagging game, it hasn't fixed after lots of patches and maintanances. Crystal drop rates are very very poor. Premium hero crystals can be said 2* hero crystals and the cost of them is insane. When you collect sufficient number of 4* and 5* shards and open those crystals, kabam has their unique thrash champs ready for you. If you want to get something good out of this game you have to spend a good amount of cash for those thrash...  "")",3
230,"Everything else is great, EXCEPT the amount of ads... I love the game, but I don\'t want to keep turning on and off airplane mode so I can actually enjoy it.  Edit: there are ads after I go into settings and more information, which doesn\'t leave the app!? Seriously? And the ""messages"" are all more ads for other apps too, lol. Bro calm down with the ads. This is why I\'m now uninstalling.  ')",2
231,"Its a good game, but i think the screen moves a little to fast. It hurt my eyes trying to play with my son.  ')",3
232,"Ads are so annoying after EVERY level or a every time I go onto the app. I get adds honestly bit think it's a bit excessive especially when  the game stops mid go and goes straight to am ad. Really?!! Looking at the comments it's not even worth upgrading to the premium. Great game but due to ads I'll be uninstalling this.  "")",2
238,"I've spent over 150 pounds on this game in 2 months alone,  and I'm not complaining. But now it says that my card has been declined, I don't have another, maybe I spent too much money on the game? Can u please get in touch with me to rectify this issue? Much appreciated! People should be able to but the apps and all choices within it for around 5 to 10 pounds,  that way u end up getting more money, I believe that should be an option.  "")",3
239,"To many freaking Aaadddddsssss UGH! really one right after another. I I mean come on I barely play I die and then an ad comes on ECT.... I don't even have time to figure out how to play it without dying right away. You know what I mean??? ÙüèÏÀ_Gezz!ÙüèÏÀ_  "")",3
241,"I am really dissapointed with one of the features of this app. I was so happy playing this game and enjoyed it alot but once I formatted my phone and tge game gone and when I reinstalled it like all other app as I do it just retured me my high score. None of my hoverboards, characters or the missions that I completed recovered. I am so sad and disheartened just because I unlocked so may characters and was enjoying it but it did not returned me allÙüèÏå´ÙüèÏå´ÙüèÏåµÙüèÏåµÙüèÏå_ÙüèÏå_ÙüèÏå¤ÙüèÏå¤ÙüèÏå¬. Please add this to your features that as you save the score through facebook do save all the unlocked characters and boards too and all the completed missions too . Its really a humble request because I loved this game so much and I am sorry it so ruined my mood to play it again.  ')",1
244,"I would give it all 5 stars but I transfered from apple and I bought the game on there and connected my Nintendo account and now my games reset and I have to buy it again. So this sucks because I loved the game. I'm not calling apple support to take away my purchase so I can then use it on my Samsung it's idiotic. Nothing anyone can do guess I'll just have to wait to get an iPhone again.  "")",1
245,"This game is ok however the Add are really annoying and come on every time I click on and off a puzzle.Also I think the choice of puzzles and quality is very bad;I wouldn't  recommend this game.  Try 'Sandbox' instead ,it's much better!!  "")",3
247,"Controls are awful. Can\'t set zoom level. And the worst part is the overwhelming ads! ""Played"" for 10 minutes and almost half that time was spent watching ads after my plane was hit. Without the ads I might spend a little more time with the game but first impression is that it\'s boring long-term and definitely not the ""most addictive plane game"" on Google Play.  ')",1
248,"Great time killer. But it far from relaxing when you play 5s and lose and have to watch a 30s ad. That is ridiculous! Ads should appear once in a while, not just when you die. Also, the new challenges are a great improvement, but again... Those 4 modes are just copies with different screen orientations. I just flip my phone accordingly... I think that is not what is pretended!  ')",3
250,"This is a great game, but the lengthy 30 sec ads after almost every round just ruins the game play, to a point that I lose interest and finally just shut off the game. Giving ""only"" the option of buying a short period of no ads is a terrible business model and just gouges your customers. Ridiculous. Give players the option to purchase an ""ads free"" version and this could be a 5 star game.  ')",3
253,"It's to many ads like beyond the amount I've seen on any other app. You lose a life then there a 30 sec ad after every time you lose a life. When the ads over you jump right back into the game. Making it difficult to play because it doesn't give you enough time to make your next move. If they remove the ads may it would be a better game.  "")",1
254,"It keeps on gliching. First it goes fast and then suddenly it slows down. This messes with how you play the game and I don't like that. But I do like the gameplay. That part is addictive and fun but it is aggravating trying to play when it gliches all the time.  "")",3
255,"I like the game; however, my phone gets too warm/hot while playing.. I never get this issue to simillar games. Will remove the app if there's no update, or fix, on this issue.  Using LG G Pro 2.  "")",1
257,"the game is terrible mainly because this ad that kept popping said i had a virus on my phone. my phone was acting lerfectly fine, and only when i am on this app, it shows up. is there any way that could stop? this is really dumb.  ')",1
261,"After paying for premium memberships the bugs are annoying because there is no way to get anything lost back. I've had many bugs but a staff responds in a timely manner and they try to address all problems. Overall it's a cool game  "")",1
262,"Would be a lot better if you didn't have to watch an ad video or force-close the app after every single game you play. Really annoying. Would've been a 5* rather than 3* if ads didn't cover the screen at every opportunity. Also, not the developers' fault as such but tbh it's not really suited to touchscreens. Would probably be really good on a phone with physical buttons though  "")",3
263,"Hi Niantic, what are you thinking! I'm out of pokeballs and I don't have any coins! Check my location, there's no gyms and no raid battles! I have only one pokestop to spin and I get only about 10 pokeballs everyday! How do I play? without anything except one pokestop! My Username is Noor00786123 in Pokemon trainer club! S**t! Add some! You f***!!! Then I'll put 5 stars.  "")",1
265,"Cool little Frogger-style game, with loads of wacky characters to collect. 2 things I don't really like: just a bit too many ads, although it is nice to be able to earn coins by watching them and there is no time limit; I wish multiplayer mode gave a way to earn coins as well. Otherwise, fun time-killer!  "")",3
266,I dont know about you guys but for me the last update of today didnt work :( ugh. The game is working so lagged and clunky. Feels horrible. It used to be such a wonderful game.  '),1
268,"Simple game laggy controls on the s8... quite boring and way too many adds after every single time you have to restart it's just ad after ad. Don't bother with the game you will get bored too quick and fall asleep. Even after upgrading it makes it harder and harder rather than a progression the further you go... uninstalled after 10 minutes.  "")",1
269,"I have a new phone and I am past level 50 I don't want to start the whole game again. I have seen a tutorial on YouTube of how to restore your account but that option is not on my phone maybe it is because I have an android? Please fix this problem as it took ages to get this far and I would not like to start again.  "")",3
272,"The game looks interesting, but when you've finished the tutorial you have to give permissions to Contacts (and then maybe other permissions), which is a big red flag for me. There is absolutely no reason ask for permissions like this just to sign up, with no way to proceed and gracefully opt-out!  Beware that by giving them the Contacts permission you are giving away other people's information, not just your own! 'Just say no' to invasive app permissions.  "")",1
275,The stories are great and with all the new added features like the ability to make your own story and create a profile. BUT its so hard to play any of it when you have to pay like 20 gems for tons of things. I dont have the kind of money to just buy a bunch of gems everyday. If you could either lower the price or give more gems out every chapter i can guarentee you your money will increase and so will the amount of people playing.  '),2
276,Very good game. Could use some work and all my holiday candy canes went away when I updated. And I lost my gold too. Can you roll that back? Ill rate higher if you are responsive and help my situation.  '),3
280,"I understand ads. And that\'s fine. But they pop up what seems like every other game round and you have to click the ""x"" twice to get back to game play. Will try similar app to see how ads are before deleting this one.  ')",3
281,"I know that I am using free version. It doesn't mean you will show add every time I got out. Uninstalled the app after using it for ~10 min  "")",1
282,"Only reason it is getting 2 stars is because of the ads and every game I play, it is begging me to rate it. So here is the stupid rating. Other than that, its a lot of fun  ')",2
283,"The best part of a game is the lore, authenticity, plot, quests and rewards not letting aside the humor. This game lacks a few key ingredients and the fact that just real life $ dictates your game play... totally makes it prone to fail. You deal with players who will get bored buying everything easy or players quitting because they don't want to spend real $ on a phone game with no lore, continuity or value per se.  "")",3
284,"You do the same thing every time plus it doesn't fit my headset  "")",1
285,"It's ok for a basic Sudoku app. The difficulty should be a little higher at the highest level. The number buttons are close enough together that I often hit the wrong mumbwr;this doesn't seem like a big problem, except when filling in pencil marks with the wrong number and not realizing it. This happens almost every game. Perhaps the most annoying part is that the between-game ads are videos with a lot of sound, even when the sound setting is turned off. If you're trying to play sudoku somewhere quiet, don't finish games.  "")",2
288,"Fun at first but it gets repetitive and the characters all share similar fight styles.  Gamaro,storm and black widow all the same, hulk colossus, rhino the same...would help to make all the characters a bit more unique.   Have to spend $$ to get 4 star+ players.  These new updates make you spend $$$ to compete, otherwise you hit a wall and stall out.  They need to be more rewarding with the good prizes and not make it so difficult that need spend $$$ for resources.  There has to be a better balance  ')",3
290,"So many aaaaaaaddddddssssssss!!!!!!! The game itself is super fun! But the amount of ads is ridiculous and effectively kills the enjoyment. Now every ad opens the play store regardless of if you watch the whole ad or hit the X to close it. This is the last straw. I'm rating one star until this gets fixed. Will give 5 stars when the ads no longer inhibit gameplay so severely.  "")",1
292,"Why does this game need to know my location, and access my phone's contacts and media files. Seems alittle sketchy to me. Game operates on the greedy main stream model of flaunting ads to the end user. Get some morals. Do not play or download!  "")",1
293,"Just go play in traffic, you'll have more fun and some how be more productive. I had an entire essay typed out but it decided to delete itself, so before I go KMS, save yourself the same fate and play literally any other Moba or anything for that matter. You're welcome, see you in the 7th circle of the Inferno.  "")",1
295,"It is considered cheating when you make us watch in-game video and don't send the item. Has happened on all occasions that I have tried. Developers r obviously dishonest.  "")",2
296,"Okay, so when you first play, it's fun. But unless you have 100K dollars to spend in this game, don't bother. Once your kindgom opens, people who've been playing for a year, and spend $30,000 a day, move to your world and kill everyone. Don't play this game unless you like being used and spit back out.  "")",1
298,"Every thing is awesome except the diamonds don't stretch out far at all. During game play it should cost less diamonds to pick a better/more appropriate response . I would and I bet other people would to, be more willing to purchase diamonds knowing they would last longer than just 2 special responses. And you should give more keys, it takes WAYYYY to long to finish a book. It's pretty frustrating.  "")",2
299,"I don't like this game at all because there is way too much lag and every time you die, there is always an ad. I really like this game though and I wish I could play it without the lag. It is also very addicting. If you fix any lag in this game and maybe get rid of most of the ads, I will rate this game 5 stars and I will re-download the game. Thank you for this awesome game though. Luv it!  "")",2
300,"For some reason, I can no longer play any games (started the problem from December 20. But before that, it was fine). After joining, the games seems to freeze on me (with me as the only player on the list). I tried everything: reinstall Roblox, play a different game, clear data/cache, force stop the app, and check my internet connection (I got good wifi signal). I can go and send a text, edit my avatar, and see who is online just fine...  ')",3
301,"I hated everything I didn't even download it because it is for everyone 10 and up and I'm only 8!Who ever made this you have to change this into a kids game!But I think it is a good game so I'm downloaing it right now! Ps:It is a good game keep making more games! Please  "")",1
302,"This game was perfect.  Very good graphics, love the characters, music, sound effects, animations/effects, and love the silliness.  Very good blast style game, but starting at level 500 and above the game has gotten very hard and forces you to use boosts to beat the levels.  I like games that are challenging and make you think, not games that get so frustrating that they are no longer fun.  I will be uninstalling.  ')",2
306,"Addictive game with stupid 72 hour level waits. That part is extremely annoying. Update. After moving to a new phone I'll give you one star. So I login with my user ID and all of my game progress is there. What's not there? ALL, EVERY, booster I ever won or accumulated. Why? Stick it where the sun doesn't shine. Buh-bye King.  "")",1
307,"Could be a great game if the controls were not so garbage. I have no idea how to do slight turns because if I try, my plane does a complete 180 into a trailing missle. Just make the controls more consistent  ')",2
308,"I mara it has a good concept and is pretty original, but there is just WAY to many adds. Every time I lose, it immediately goes to a 30 second add that you can't close out of. This is just stupid stupid, and I am probably goanna end up deleting the APP out of annoyance.  "")",3
312,"Its a lot of fin BUT there arw too many ads and you constantly ask me to eate the game and it get annoying along with rhe constant ""rate now?"" , ""rate now?"" But other than that , good game  ')",3
