,review_comments,star_rating
313,"The game is actually moderately enjoyable. The premise is fun, and it makes good sense. The 30 second unskippable ads make this literally unplayable. Could I buy the premium version? Sure. But I'm not going to pay for a game that I cannot play long enough to give you a truer account of how much I like it. I can only account for the few moments I was allowed to play between ads.  "")",2
315,"Okay.... so. I'm sorry to be so petty, but this is how I feel. The game is good. It's fun and easy to pick up. Now my problem. This game is a blatant ripoff of Word Cookies. Absolute definition of benchmarking, borderline plagiarism. If this game is made by the same group AS Word Cookies, I will edit my review to 5-stars. If this is a copycat, money-dash attempt, my rating will stay. And I see nothing of BitMango anywhere for this app. ÙüèÏÛª  "")",1
316,"To much adds.  Adds for stuff that people are playing will never use.  A constant add at the bottom of screen and fullscreen after each round worse than tv adds.  You Can spell words that don't count for anything.  I spelled 8 legitimate words with the letters given and nothing. Waste of time.  This game needs improved. must have been developed by a 4th grader with limited vocabulary.  "")",2
319,This game is good and all but... if you add to many one shot kills weapons.Its Quite hard people keep spammin the Anti champion rifle and cheaper than Anti hero rifle.It will destroy PIXEL GUN 3D players.SO PLS FIX THISÙüèÏå¢ youre making ur game worse than before.I MISS THE OLD PG3D!not this one.EVERYONE just play pixel strike 3D  '),2
324,"I have been playing this for years and love it. Bug fixes have helped a great deal. During the Christmas challenge I once again had the opportunity to get the Clauses. I\'ve had them several times and spent my hard earned gems for them. They disappear and it costs me again?? I didn\'t bite this year. I like the ""new"" daily challenges.  I know this is ad based game. Maybe you could talk to the Final Fantasy people about their incredibly lame and LONG ad.  ')",2
326,"Iconic game but current versions very buggy. Temporary blades disappear after a couple of hours instead of the 12 or 24 hours claimed, and at certain points, if you swipe on arcade it'll take you to classic.  "")",3
328,"Game doesn't make any sense, as you upgrade the blocks upgrade too. You can't make it any further the higher level you get than you could at lower levels. Kinda makes getting HP pointless, it's only gonna be the same game only faster. Good concept, horrible implementation.  "")",2
332,"Fun at first, incredible grind later on (cards, money, ability upgrade mats, etc). A lot of stuff doesn't scale with the level. Pay2win model to get cards (11âÂ for something eh, 42âÂ for the better popular heroes) - spending crystals for these packs instead of real money gives you a chance to get between 10-330 cards, but 90% of the time you're in the lower spectrum. Those that spent money are basically unbeatable due to their heroes' synergies.  No wonder it was made by EA.  "")",2
333,"Seems like a rigged game.. Notice how anyone well experienced and skilled has a winning percentage in the 50% range... after ranking 20-25 it gets to a point where no matter how skilled you are, the balls don't go as directed,  especially the cue spin... and you Lose. Tons of potted cues... basically wants you to buy coins vs truly winning them.  "")",2
334,"Please help: I absolutely love this game and have never put so much money into a game before, but I really need help with this ""Client and Server are Out of Sync"" error on my android device. I have tried to message via Facebook but haven\'t received a reply. Can you kindly assist me? My user ID is #2YJVPV092. I will gladly change to a 5 star after.  ')",1
335,"I love the game.  But, it seems I have to use gems to buy almost everything.  A character should not wear the same clothes for days just because I refuse to use my gems.   The free are OK, but that means I will only be able to play two episodes every day.  It kills the fun sometimes.    The purchase of gems and passes is took expensive too.   I want to be able to  dress up my characters at any time.  Please also try to create a closet where the characters can change their clothes at any time without having to buy it.   The game is interesting but seems it's for the rich alone  "")",3
338,"Like the game, but dislike how many ads there are and I can't find where I can turn them off.  "")",3
342,"Too many ads.  When they pop up DURING gameplay,  it ruins your play.  Give us a paid NO AD version  ')",2
343,"I have played this game for a while, it is addictive and fun, have met some really cool people on here, but I don't like how it's a pay to win game. I may not be staying on it much longer if things don't change on it. The chat you can't delete so when scrolling up it freezes my phone up, any packages you may want to buy are super expensive, and not worth it. Everything that could be fun costs real money which is making the game a lot less fun, you can't hatch chocobos, or level a new hero without spending money. Which is why I dropped my rating.  "")",3
344,All you can do is basically sit there and watch lines move! i mean cant you make it actually fun?  '),1
352,"The real issue with this game is while fun and challenging a block will always end up spawning that, unless you jump before its in frame, you die. I know this because ive even hit jump before it was in frame which shows in my screen recording and it still hit me. This completely removes the skill aspect and leaves progression up to random luck. So ill be uninstalling.  Shame cause it could be quite fun.  ')",2
355,I am not getting rewards after watching advertising videos. Especially after watching Honor mobile ad. This is cheating!!  '),2
356,"They have lost my account. 7 days later they still havn't recovered my account. Keep saying 1 more Sday. Say they won't refund the money I spent which is a considerable amount even if they can't recover my account. If they do recover my account they said I won't get compensation for the might I lost. Will probably reply here telling me to contact their enquire team. Don't this already and they are useless. Complete joke.  "")",1
357,"Fun until you think you can make it all the way through the levels. I was at a high percentage win rate, had all the balls, same clubs and levels as opponents, yet my ball just doesn't seem to fly the same or as far. I strongly feel the game curves a winner no matter what you do to force you to pay to play. I even went down several levels to keep playing and still was beat on things that made no sense. Fun for awhile, but don't waste your money  "")",1
358,"Nice stories, however the gems and keys are an issue. There needs to be at least five keys given after every hour that we wait. Or if I wait 5 hours, there needs to be 5 keys waiting on me when I open the app. Also if a story is NOT FINISHED, DO NOT PUT IT UP HERE FOR US TO READ. IT NEEDS TO BE FULLY COMPLETED! Stop making us spend money on keys and diamonds. Give us at least five diamonds per chapter. These changes need to be made or I will uninstall the app. Thank you  ')",3
